{
  "pattern": "interceptor",
  "language": "typescript",
  "support": "library",
  "idiom_name": "NestInterceptor.intercept(ExecutionContext, CallHandler) over RxJS",
  "implementation_notes": "The framework owns both roles: an @Injectable() class implementing NestInterceptor receives an ExecutionContext (the Context) and a CallHandler, and calling next.handle() - which returns an Observable - continues to the route handler; returning a different Observable without calling handle() replaces the handler entirely, which is how caching or stubbed responses are implemented. Binding is scope-selective through @UseInterceptors (controller/method) or APP_INTERCEPTOR for global registration, and dependency injection supplies collaborators. The classic Dispatcher is the Nest runtime and the classic abstract Interceptor is the typed interface plus decorator; Angular shows the same pattern for HTTP with plain functions instead of classes.",
  "code_sketch": "@Injectable()\nexport class LoggingInterceptor implements NestInterceptor {\n  constructor(private readonly logger: Logger) {}\n  intercept(ctx: ExecutionContext, next: CallHandler): Observable<unknown> {\n    const started = Date.now();\n    return next.handle().pipe(                    // continue to the handler\n      tap(() => this.logger.log(`${ctx.getClass().name} ${Date.now() - started}ms`)),\n    );\n  }\n}\n\n// @UseInterceptors(LoggingInterceptor)  -- controller or method scope",
  "pitfalls": [
    "Not calling next.handle() disables the route handler for that scope - deliberate for caching, but it also disables every interceptor bound after this one.",
    "Order follows binding scope (global -> controller -> method) and the declared order inside each level; there is no priority keyword, so a wrongly scoped interceptor silently runs before the guard it assumed had already run.",
    "Interceptors registered with useGlobalInterceptors() outside any module cannot inject dependencies (no module context) - register them through APP_INTERCEPTOR instead.",
    "RxJS semantics leak into the chain: a catchError that swallows an error prevents later operators from seeing it, and a missing handle() call leaves the request without a response stream."
  ],
  "sources": [
    "https://docs.nestjs.com/interceptors",
    "https://angular.dev/guide/http/interceptors"
  ],
  "variants": [
    {
      "variant_id": "nestjs-interceptor",
      "name": "NestJS NestInterceptor with @UseInterceptors",
      "paradigm": "oo",
      "idiom_name": "NestInterceptor.intercept(ExecutionContext, CallHandler) over RxJS",
      "implementation_notes": "The framework owns both roles: an @Injectable() class implementing NestInterceptor receives an ExecutionContext (the Context) and a CallHandler, and calling next.handle() - which returns an Observable - continues to the route handler; returning a different Observable without calling handle() replaces the handler entirely, which is how caching or stubbed responses are implemented. Binding is scope-selective through @UseInterceptors (controller/method) or APP_INTERCEPTOR for global registration, and dependency injection supplies collaborators. The classic Dispatcher is the Nest runtime and the classic abstract Interceptor is the typed interface plus decorator; Angular shows the same pattern for HTTP with plain functions instead of classes.",
      "code_sketch": "@Injectable()\nexport class LoggingInterceptor implements NestInterceptor {\n  constructor(private readonly logger: Logger) {}\n  intercept(ctx: ExecutionContext, next: CallHandler): Observable<unknown> {\n    const started = Date.now();\n    return next.handle().pipe(                    // continue to the handler\n      tap(() => this.logger.log(`${ctx.getClass().name} ${Date.now() - started}ms`)),\n    );\n  }\n}\n\n// @UseInterceptors(LoggingInterceptor)  -- controller or method scope",
      "pitfalls": [
        "Not calling next.handle() disables the route handler for that scope - deliberate for caching, but it also disables every interceptor bound after this one.",
        "Order follows binding scope (global -> controller -> method) and the declared order inside each level; there is no priority keyword, so a wrongly scoped interceptor silently runs before the guard it assumed had already run.",
        "Interceptors registered with useGlobalInterceptors() outside any module cannot inject dependencies (no module context) - register them through APP_INTERCEPTOR instead.",
        "RxJS semantics leak into the chain: a catchError that swallows an error prevents later operators from seeing it, and a missing handle() call leaves the request without a response stream."
      ],
      "sources": [
        "https://docs.nestjs.com/interceptors",
        "https://angular.dev/guide/http/interceptors"
      ]
    },
    {
      "variant_id": "angular-http-interceptor",
      "name": "Angular functional HTTP interceptors",
      "paradigm": "functional",
      "min_standard": "TypeScript4.7",
      "idiom_name": "HttpInterceptorFn with withInterceptors([...])",
      "implementation_notes": "Angular's recommendation is the functional form: an interceptor is a function (req: HttpRequest<unknown>, next: HttpHandlerFn) => Observable<HttpEvent<unknown>>, registered declaratively with provideHttpClient(withInterceptors([...])), where the order in the array is the chain order. Because HttpRequest/HttpResponse are immutable, an interceptor modifies a request by cloning it (req.clone({...})) - which also makes retries idempotent - and per-request metadata travels in the typed HttpContext map (HttpContextToken) instead of ad-hoc headers. The class-based HttpInterceptor + HTTP_INTERCEPTORS form is the legacy variant; the classic Dispatcher is Angular's HttpClient and the classic Interceptor role is the function signature.",
      "code_sketch": "export function authInterceptor(\n  req: HttpRequest<unknown>,\n  next: HttpHandlerFn,\n): Observable<HttpEvent<unknown>> {\n  const token = inject(AuthService).token();\n  return next(req.clone({ headers: req.headers.set('Authorization', `Bearer ${token}`) }));\n}\n\n// provideHttpClient(withInterceptors([authInterceptor, retryInterceptor]))",
      "pitfalls": [
        "Requests are immutable: mutating req.headers directly does nothing (or throws in strict mode) and the change is silently lost - always clone.",
        "Interceptors only see requests made through HttpClient; calls made with fetch/axios bypass the chain entirely, so a security header added here can be missing elsewhere.",
        "The response stream can emit several events, so an interceptor must filter on the terminal event (HttpEventType.Response) before acting on a body.",
        "Injecting dependencies works because functional interceptors run in the injection context of the registering injector - capturing services at module scope (outside the function) fails or binds to the wrong injector."
      ],
      "sources": [
        "https://angular.dev/guide/http/interceptors"
      ]
    }
  ],
  "default_variant": "nestjs-interceptor",
  "version": "1.0"
}
