{
  "pattern": "kiss-principle",
  "language": "javascript",
  "support": "idiomatic",
  "implementation_notes": "Prefer plain functions and modules over classes, state-management libraries and build-time magic. `fetch` + async/await before an HTTP client framework; `Map`/`Set` before a state library; a plain object before a class instance.",
  "version": "1.0",
  "idiom_name": "plain functions + modules, framework only when the need is real",
  "code_sketch": "export async function loadOrder(id) {\n  const res = await fetch(`/api/orders/${id}`);\n  if (!res.ok) throw new Error(`order ${id}: ${res.status}`);\n  return res.json();\n}",
  "pitfalls": [
    "Redux-style boilerplate for local component state",
    "Wrapping fetch in a generic request layer with one caller",
    "Optional chaining chains that hide which branch actually runs"
  ]
}
