{
  "pattern": "premature-optimization",
  "language": "ruby",
  "support": "manual",
  "implementation_notes": "Ruby's premature optimisation has a Rails-shaped form: replacing ActiveRecord's query interface with raw SQL for speed before measuring, which usually produces a slower query because the ORM's eager loading avoids N+1 round trips that the raw version reintroduces. The second is micro-optimising a block that runs once per request, where the block itself is not the cost. The third is a hand-rolled cache in front of a method that was never slow. The genuinely valuable early choices are the ones that are also clearer — `pluck` instead of `select(...).map`, `includes` instead of manual joins — and those should be argued on clarity.",
  "version": "1.0",
  "idiom_name": "micro-optimising a block; replacing Rails' query interface",
  "code_sketch": "# premature: raw SQL \"for performance\" on an association\nOrder.where(\"customer_id = ?\", c.id).map { |o| o.lines.to_a }\n# measured: N+1 queries (network-bound, not CPU-bound)\n# fix: Order.includes(:lines).where(customer: c)  -- also clearer",
  "pitfalls": [
    "Raw SQL replacing the query interface without a measurement, which frequently reintroduces N+1 round trips.",
    "Micro-optimising blocks in a view or a helper that render once per request.",
    "`ObjectSpace` and GC tuning added from an article rather than from `GC.stat` output.",
    "Choosing a faster gem on a benchmark of a different workload."
  ],
  "sources": [
    "https://en.wikipedia.org/wiki/Premature_optimization",
    "https://guides.rubyonrails.org/active_record_querying.html"
  ]
}
