{
  "pattern": "bounded-context",
  "language": "generic",
  "support": "native",
  "implementation_notes": "Name the context, name the model it owns, and name the team that owns it. If two contexts would share both the model and the language, they are one context with two code bases.",
  "version": "1.0",
  "idiom_name": "context = model + ubiquitous language + team + boundary",
  "code_sketch": "context Billing:\n  model: Invoice, CreditNote, PaymentTerms\n  language: \"credit\" means X here, Y in Sales\n  owner: billing-team\n  not: reads orders tables directly",
  "pitfalls": [
    "Calling a subdomain a bounded context",
    "Sharing a schema across contexts"
  ]
}
