{
  "pattern": "half-sync-half-async",
  "language": "typescript",
  "support": "idiomatic",
  "idiom_name": "typed worker pool and message protocol over the event loop",
  "implementation_notes": "TypeScript inherits the JavaScript host model: the event loop is the asynchronous layer, worker_threads or libuv's internal pool is the synchronous layer, and async/await carries the eventual result as Promise<T>. What the type system adds is the boundary contract - model queue messages as discriminated unions so the asynchronous layer cannot enqueue a shape no worker handles, and type the worker's response so the join back into the promise is checked - which removes the most common failure of this pattern in practice. Downlevel async emit adds helper machinery but does not change the layering; the explicit worker pool is still justified for CPU-bound stages, where it is the only way to use more than one core.",
  "code_sketch": "type Job = { kind: 'resize'; path: string; width: number }\n         | { kind: 'hash'; path: string };\ntype Result = { ok: true; value: string } | { ok: false; error: string };\nconst pool = Array.from({ length: 4 }, () => new Worker(new URL('./worker.ts', import.meta.url)));\nlet inflight = 0;                                   // bounded in-flight set\nfunction submit(job: Job): Promise<Result> {\n  const w = pool[inflight++ % pool.length];        // queueing layer\n  return new Promise((resolve) => { w.once('message', resolve as (r: Result) => void);\n                                    w.postMessage(job); });\n}",
  "pitfalls": [
    "A worker's message channel has no back-pressure: track outstanding promises and throttle, the in-flight set grows otherwise.",
    "Types do not survive postMessage; the message must be narrowed or validated in the worker instead of being cast with as any.",
    "Importing a synchronous native addon on the main thread blocks the event loop even though the surrounding code is async.",
    "One shared Worker receiving interleaved jobs needs a correlation id, otherwise responses are resolved against the wrong request."
  ],
  "sources": [
    "https://nodejs.org/api/worker_threads.html",
    "https://developer.mozilla.org/en-US/docs/Web/JavaScript/Event_loop",
    "https://www.typescriptlang.org/docs/handbook/release-notes/typescript-2-1.html"
  ],
  "version": "1.0"
}
